{
  "schemaVersion": 1,
  "id": "sprache-business-english-practice-1",
  "title": "비즈니스 영어 실전 문제팩 1",
  "description": "Part 1~7 구성의 독자 제작 200문제와 정답 근거·선택지 풀이를 제공합니다.",
  "language": "en",
  "version": "1.0.0",
  "revision": 1,
  "publishedAt": "2026-09-03T03:00:00.000Z",
  "license": "Sprache-original-practice-content",
  "attribution": "Original questions authored for the Sprache project; format references ETS public test descriptions only.",
  "disclaimer": "TOEIC® is a registered trademark of ETS. This product is not endorsed or approved by ETS. 공식 또는 기출문제를 포함하지 않습니다.",
  "stimuli": [
    {
      "id": "p1-scene-1",
      "kind": "photo",
      "title": "회의실",
      "visualDescription": "두 직원이 회의실 탁자 위의 서류를 함께 살펴보고 있다."
    },
    {
      "id": "p1-scene-2",
      "kind": "photo",
      "title": "기차역",
      "visualDescription": "여행객 한 명이 전광판을 확인하며 여행 가방 손잡이를 잡고 있다."
    },
    {
      "id": "p1-scene-3",
      "kind": "photo",
      "title": "식당",
      "visualDescription": "종업원이 야외 테이블에 접시를 놓고 있다."
    },
    {
      "id": "p1-scene-4",
      "kind": "photo",
      "title": "창고",
      "visualDescription": "작업자가 선반에 상자를 정리하고 있다."
    },
    {
      "id": "p1-scene-5",
      "kind": "photo",
      "title": "사무실",
      "visualDescription": "한 여성이 책상에서 헤드셋을 끼고 전화 통화를 하고 있다."
    },
    {
      "id": "p1-scene-6",
      "kind": "photo",
      "title": "공원",
      "visualDescription": "관리인이 산책로 옆 화단에 물을 주고 있다."
    },
    {
      "id": "p2-audio-1",
      "kind": "questionResponse",
      "title": "Question 1",
      "audioScript": "Where should I leave these packages? A. On the counter by the door. B. They arrived yesterday. C. No, I did not order lunch."
    },
    {
      "id": "p2-audio-2",
      "kind": "questionResponse",
      "title": "Question 2",
      "audioScript": "When will the budget meeting begin? A. In the main conference room. B. At ten thirty. C. The budget was approved."
    },
    {
      "id": "p2-audio-3",
      "kind": "questionResponse",
      "title": "Question 3",
      "audioScript": "Who is leading the orientation today? A. It lasts about an hour. B. In the training room. C. Ms. Patel from Human Resources."
    },
    {
      "id": "p2-audio-4",
      "kind": "questionResponse",
      "title": "Question 4",
      "audioScript": "Why was the shipment delayed? A. There was a problem at the port. B. By express delivery. C. About twenty boxes."
    },
    {
      "id": "p2-audio-5",
      "kind": "questionResponse",
      "title": "Question 5",
      "audioScript": "How often is the safety equipment inspected? A. The inspector is downstairs. B. Once every three months. C. It is very reliable."
    },
    {
      "id": "p2-audio-6",
      "kind": "questionResponse",
      "title": "Question 6",
      "audioScript": "Could you send me the revised schedule? A. The train was on time. B. I revised the price. C. Sure, I will e-mail it now."
    },
    {
      "id": "p2-audio-7",
      "kind": "questionResponse",
      "title": "Question 7",
      "audioScript": "Haven’t we met at a trade show before? A. Yes, in Singapore last year. B. The show starts at noon. C. I will introduce the speaker."
    },
    {
      "id": "p2-audio-8",
      "kind": "questionResponse",
      "title": "Question 8",
      "audioScript": "Which printer should I use? A. I printed fifty copies. B. The one next to the supply cabinet. C. The paper is recyclable."
    },
    {
      "id": "p2-audio-9",
      "kind": "questionResponse",
      "title": "Question 9",
      "audioScript": "Would you like tea or coffee? A. Yes, I liked the café. B. The cups are in the cabinet. C. Coffee, please."
    },
    {
      "id": "p2-audio-10",
      "kind": "questionResponse",
      "title": "Question 10",
      "audioScript": "The lobby renovation looks nearly finished. A. Yes, only the lighting remains. B. I finished the report yesterday. C. The lobby is on the first floor."
    },
    {
      "id": "p2-audio-11",
      "kind": "questionResponse",
      "title": "Question 11",
      "audioScript": "Do you know whether the client confirmed the order? A. The order form is blue. B. I’ll check the latest message. C. We met the client downstairs."
    },
    {
      "id": "p2-audio-12",
      "kind": "questionResponse",
      "title": "Question 12",
      "audioScript": "Why don’t we move the display closer to the entrance? A. The entrance fee is ten dollars. B. I moved here last month. C. That should attract more visitors."
    },
    {
      "id": "p2-audio-13",
      "kind": "questionResponse",
      "title": "Question 13",
      "audioScript": "How many applicants did you interview? A. Six in total. B. For the accounting position. C. At the downtown office."
    },
    {
      "id": "p2-audio-14",
      "kind": "questionResponse",
      "title": "Question 14",
      "audioScript": "Is the cafeteria still serving lunch? A. The soup was delicious. B. No, it closed at two. C. I served on the committee."
    },
    {
      "id": "p2-audio-15",
      "kind": "questionResponse",
      "title": "Question 15",
      "audioScript": "Where did you put the signed contract? A. The director signed it. B. We renewed it for a year. C. It’s in the top drawer."
    },
    {
      "id": "p2-audio-16",
      "kind": "questionResponse",
      "title": "Question 16",
      "audioScript": "Should I reserve a small room or the auditorium? A. The auditorium would be safer. B. The reservation is under Lee. C. The speech was interesting."
    },
    {
      "id": "p2-audio-17",
      "kind": "questionResponse",
      "title": "Question 17",
      "audioScript": "Can the maintenance team fix this today? A. The fee is included. B. They are already on their way. C. I fixed the date on the form."
    },
    {
      "id": "p2-audio-18",
      "kind": "questionResponse",
      "title": "Question 18",
      "audioScript": "What did the survey participants receive? A. Nearly two hundred people. B. They completed it online. C. A discount coupon."
    },
    {
      "id": "p2-audio-19",
      "kind": "questionResponse",
      "title": "Question 19",
      "audioScript": "Didn’t Maria submit the proposal? A. She asked for one more day. B. The proposal has three sections. C. Yes, Maria designed the logo."
    },
    {
      "id": "p2-audio-20",
      "kind": "questionResponse",
      "title": "Question 20",
      "audioScript": "How do I connect to the guest network? A. The guests arrived early. B. Use the password on your badge. C. The network meeting was canceled."
    },
    {
      "id": "p2-audio-21",
      "kind": "questionResponse",
      "title": "Question 21",
      "audioScript": "When are the replacement parts expected? A. The machine needs three parts. B. I replaced the batteries. C. Sometime on Thursday afternoon."
    },
    {
      "id": "p2-audio-22",
      "kind": "questionResponse",
      "title": "Question 22",
      "audioScript": "Who approved the new travel policy? A. I believe the finance director did. B. Travel takes about two hours. C. The policy starts next month."
    },
    {
      "id": "p2-audio-23",
      "kind": "questionResponse",
      "title": "Question 23",
      "audioScript": "Would you mind lowering the volume? A. The volume is on the shelf. B. Not at all—I’ll turn it down. C. I lowered the price yesterday."
    },
    {
      "id": "p2-audio-24",
      "kind": "questionResponse",
      "title": "Question 24",
      "audioScript": "Why is the west entrance locked? A. Use the westbound platform. B. I left my key at home. C. It is being painted this morning."
    },
    {
      "id": "p2-audio-25",
      "kind": "questionResponse",
      "title": "Question 25",
      "audioScript": "Has the invoice been corrected yet? A. Yes, the updated one is attached. B. The invoice total is high. C. I attached the poster to the wall."
    },
    {
      "id": "p3-conversation-1",
      "kind": "conversation",
      "title": "호텔 예약",
      "audioScript": "Woman: Good morning. I booked a room for two nights, but my confirmation shows only one.\nMan: I can correct that. May I see your confirmation number?\nWoman: Certainly. It is H-4821. I also requested a room away from the elevator."
    },
    {
      "id": "p3-conversation-2",
      "kind": "conversation",
      "title": "제품 시연",
      "audioScript": "Man: The client moved tomorrow’s product demonstration to three o’clock.\nWoman: Then we have time to test the new projector in the morning.\nMan: Good idea. I’ll also bring printed copies of the pricing sheet."
    },
    {
      "id": "p3-conversation-3",
      "kind": "conversation",
      "title": "배송 문의",
      "audioScript": "Woman: My tracking page says the office chairs were delivered, but they are not here.\nMan: Let me contact the driver. The shipment may have been left at the loading entrance.\nWoman: Please ask the facilities team to check there as well."
    },
    {
      "id": "p3-conversation-4",
      "kind": "conversation",
      "title": "교육 일정",
      "audioScript": "Man: Are you attending the spreadsheet workshop on Friday?\nWoman: I planned to, but my supervisor scheduled a client call at the same time.\nMan: The trainer is offering the workshop again next Tuesday."
    },
    {
      "id": "p3-conversation-5",
      "kind": "conversation",
      "title": "식당 행사",
      "audioScript": "Woman: We need a vegetarian option for the company dinner.\nMan: The chef can prepare mushroom pasta if we confirm the number by Wednesday.\nWoman: I’ll survey the staff this afternoon."
    },
    {
      "id": "p3-conversation-6",
      "kind": "conversation",
      "title": "인쇄 오류",
      "audioScript": "Man: These brochures have the old telephone number on the back.\nWoman: I sent the printer a corrected file yesterday.\nMan: I’ll call them before they produce the remaining copies."
    },
    {
      "id": "p3-conversation-7",
      "kind": "conversation",
      "title": "공항 이동",